### ISSUE TITLE
 Lua Error parsing Growatt Data since WireShark Release 4.4.0

### ISSUE THREAD

**Issue by kreisquer** [akupila/wireshark-growatt#1]
#### Example Frame 10521 from sample date `growatt.pcapng`:
`Frame 10521: 639 bytes on wire (5112 bits), 639 bytes captured (5112 bits) on interface en0, id 0
Ethernet II, Src: RivetNetwork_89:0b:df (9c:b6:d0:89:0b:df), Dst: Apple_c7:f8:14 (6c:7e:67:c7:f8:14)
Internet Protocol Version 4, Src: 192.168.1.54, Dst: 192.168.1.99
Transmission Control Protocol, Src Port: 23027, Dst Port: 5279, Seq: 5241, Ack: 649, Len: 585
Growatt Protocol data
Lua Error: ...ers\xxxxxx\AppData\Roaming\Wireshark\plugins\growatt.lua:54: attempt to index a nil value (global 'bit32')
    [Expert Info (Error/Undecoded): Lua Error: ...ers\xxxxxx\AppData\Roaming\Wireshark\plugins\growatt.lua:54: attempt to index a nil value (global 'bit32')]
        [Lua Error: ...ers\xxxxxx\AppData\Roaming\Wireshark\plugins\growatt.lua:54: attempt to index a nil value (global 'bit32')]
        [Severity level: Error]
        [Group: Undecoded]
Lua Traceback
    stack traceback:
     ...ers\xxxxxx\AppData\Roaming\Wireshark\plugins\growatt.lua:54: in upvalue 'unscramble'
     ...ers\xxxxxx\AppData\Roaming\Wireshark\plugins\growatt.lua:76: in function <...ers\xxxxxx\AppData\Roaming\Wireshark\plugins\growatt.lua:65>
`
#### Lua Version changed in 4.4.0 according to release notes

"Support for Lua 5.3 and 5.4 has been added, and support for Lua 5.1 and 5.2 has been removed. The Windows and macOS installers now ship with Lua 5.4.6."
Currently no idea what is wrong here.

#### Comparison of Version 4.4.1 and Version 4.2.8

![20241117-WireShark-4-4-1-vs-WireShark-4-2-8-sample-data](https://github.com/user-attachments/assets/a8622090-a7bf-4b45-8c50-0759db3b564b)

**Comment by akupila** [comment]
Thanks for the detailed report! Turns out the Lua update was indeed causing this. I've pushed https://github.com/akupila/wireshark-growatt/commit/fd8f09f353ca4d2f9f034f57a6ea015f6e52ff8a to fix this
